line #,episode #,episode,name,line,arc #,arc
1.0,E1, Campaign 1 Episode 1 Arrival at Kraghammer ,MATT,"Hello everyone. My name is Matthew Mercer, voice actor and Dungeon Master for Critical Role on Geek & Sundry, where I take a bunch of other voice actors and run them through a fantastical fantasy adventure through the world of Dungeons & Dragons. We play every Thursday at 7:00pm Pacific Standard Time on Geek & Sundry's Twitch stream. →",A1,Arc 1: Kraghammer and Vasselheim
2.0,E1, Campaign 1 Episode 1 Arrival at Kraghammer ,MATT,"Please come watch us live if you have the opportunity. Back episodes and future episodes will be uploaded on the Geek & Sundry website. You can also check them out there. In the meantime, enjoy! →",A1,Arc 1: Kraghammer and Vasselheim
3.0,E1, Campaign 1 Episode 1 Arrival at Kraghammer ,MATT,"Welcome to first episode of Critical Role, and what this basically is is a continuation of our weekly D&D game. Me and a bunch of other likely nerdy and enjoyable voice actors gathering around, rolling some dice, killing some creatures, having some adventure. Now we have the pleasure of bringing it on the stream for you to watch, enjoy, and occasionally interact with. Before we get to that, to give you a little backstory on the characters you'll be seeing this evening, we're going to play some videos for you in a second. Do note for all you hardcore gamers out there, a lot of this is house-ruled, loosey-goosey having a good time. So all you number crunchers, stop paying attention there, just have fun with it. →",A1,Arc 1: Kraghammer and Vasselheim
4.0,E1, Campaign 1 Episode 1 Arrival at Kraghammer ,MATT,"Nevertheless, we have some background story on many of the characters you'll be seeing this evening to help you jump into the story. Let's go ahead and enjoy those in a minute, then we'll introduce the players. So have fun! →",A1,Arc 1: Kraghammer and Vasselheim
5.0,E1, Campaign 1 Episode 1 Arrival at Kraghammer ,TRAVIS,"Right, listen up! If you have ale, then you have a friend in Grog Strongjaw! A goliath of towering height and size, this barbarian has an appetite for the two great loves in his life: combat, women, and ale! [record scratch] →",A1,Arc 1: Kraghammer and Vasselheim
6.0,E1, Campaign 1 Episode 1 Arrival at Kraghammer ,TRAVIS,"Wait. Easily the brains of the group, Grog is often consulted for his vast knowledge of shapes, colors, and shiny things! Also ale. In his early years, armed with his two-handed greataxe, Grog often enjoyed proving his might amongst the ranks of his family's wandering herd. But after coming upon an unsuspecting elderly gnome in the woods, he objected to the killing of such an innocent life. A creature of impulse, Grog felt only pity for this-- well, this terrified little thing. And his disobedience cost him dearly. Beaten bloody, and banished by the herd leader, his Uncle Kevdak, Grog was abandoned and left to die. Exiled from his herd, it was then that the relative of the very gnome he fought to save, saved him. It was the kindness of a gnome cleric named Pike that healed Grog, bringing him back from death's edge. →",A1,Arc 1: Kraghammer and Vasselheim
7.0,E1, Campaign 1 Episode 1 Arrival at Kraghammer ,TRAVIS,And they have remained close friends ever since. →,A1,Arc 1: Kraghammer and Vasselheim
8.0,E1, Campaign 1 Episode 1 Arrival at Kraghammer ,TRAVIS,"Most nights, Grog can be found challenging entire taverns to wrestling matches! Or accompanying Scanlan to the nearest house where you pay for lady favors. Also ale! →",A1,Arc 1: Kraghammer and Vasselheim
9.0,E1, Campaign 1 Episode 1 Arrival at Kraghammer ,MARISHA,"A first impression of Keyleth would leave you with little information on the half-elven druid. You might even think that her social awkwardness due to her sheltered upbringing is kind of sweet. Of course, it would be unwise underestimate her based on first impressions. →",A1,Arc 1: Kraghammer and Vasselheim
10.0,E1, Campaign 1 Episode 1 Arrival at Kraghammer ,MARISHA,[thunder crack] →,A1,Arc 1: Kraghammer and Vasselheim
11.0,E1, Campaign 1 Episode 1 Arrival at Kraghammer ,MARISHA,"Under that un-intimidating petite frame is a vicious beast waiting to be unleashed, whose natural powers have made even the fiercest of champions pee their pants, literally! Born to the Air Tribe of the Ashari people, Keyleth was raised with a deep love of nature and the elemental magics. It is her people's inherent duty to protect the delicate areas in Tal'Dorei where the four elemental planes begin to bleed with this realm. Since she was a little girl, she had quite a knack for air manipulation and beast shaping abilities. Well, if you consider kittens and flying squirrels to be little beasts. Which, I do. →",A1,Arc 1: Kraghammer and Vasselheim
12.0,E1, Campaign 1 Episode 1 Arrival at Kraghammer ,MARISHA,"Anyways, it wasn't long before the headmaster of the tribe, her father, Korren, realized her true prodigious abilities and she was inveterated to succeed him as the next headmaster. Just like that, her jovial childhood was stripped and replaced with endless spell memorization, teachings from ancient traditions, and exceedingly high expectations. Every druid leader-to-be must embark on a journey to seek out the sister tribes in order to introduce and establish respect amongst the fellow headmasters. They call this the Aramente, or Noble Odyssey. When her father felt she was ready, he set her on the path to truly discovering herself, not knowing when, or if, she will ever return. As she hiked down the mountain towards Stilben, she meditated on the task ahead. →",A1,Arc 1: Kraghammer and Vasselheim
13.0,E1, Campaign 1 Episode 1 Arrival at Kraghammer ,MARISHA,"Part of the Aramente is proving yourself a strong warrior, a valiant protector, and a wise and compassionate leader. With this knowledge, one thought plays in repeat in her mind: Is she even worthy? →",A1,Arc 1: Kraghammer and Vasselheim
14.0,E1, Campaign 1 Episode 1 Arrival at Kraghammer ,TALIESIN,"Percy was the third child of seven children, born to a noble family who lived far to the north in the ancient castle of Whitestone. →",A1,Arc 1: Kraghammer and Vasselheim
15.0,E1, Campaign 1 Episode 1 Arrival at Kraghammer ,TALIESIN,"With so many siblings to share the burdens of lordship, Percy turned his attention to the sciences, engineering, and naturalism. One day, a mysterious couple, named Lord and Lady Briarwood, came to court. During a feast held in their honor, the Briarwoods violently took control of the castle, killing or imprisoning everyone who would stand in their way. Percy awoke chained in the dungeon, only to be freed by his younger sister. →",A1,Arc 1: Kraghammer and Vasselheim
16.0,E1, Campaign 1 Episode 1 Arrival at Kraghammer ,TALIESIN,"Together they fled, chased by the Briarwoods' men. →",A1,Arc 1: Kraghammer and Vasselheim
17.0,E1, Campaign 1 Episode 1 Arrival at Kraghammer ,TALIESIN,"As they ran, Percy's sister took several arrows to the chest and fell. Percy kept running, eventually jumping into a freezing river and floating unconscious to freedom. He did not remember waking up on a fishing boat. He barely remembered the next two years, as he slowly made his way as far south as possible. Then one night, Percy had a dream. A roaring cloud of smoke offered him vengeance against those who destroyed his family. →",A1,Arc 1: Kraghammer and Vasselheim
18.0,E1, Campaign 1 Episode 1 Arrival at Kraghammer ,TALIESIN,"When he awoke, Percy began to design his first gun. →",A1,Arc 1: Kraghammer and Vasselheim
19.0,E1, Campaign 1 Episode 1 Arrival at Kraghammer ,SAM,"Oh, you haven't heard of Scanlan Shorthalt? Well, gird your loins, ladies, because he has his eye on you. A talented musician, master of disguise, and dashingly handsome in his own mind, Scanlan sings songs almost as much as he sings his own praises. Born a poor gnome, Scanlan used his endless charm and soaring tenor voice to croon for coin and support his single mother. One day, he was discovered by a half-orc promoter, and joined Dr. Dranzel's Spectacular Traveling Troupe where he learned the ways of the world, and honed his skills as a bard extraordinaire. A loner much of his life, Scanlan has never quite come to terms with the violent death of his mother at the hands of a goblin invasion. While his years on the road provided many, shall we say, educational experiences with the opposite sex, deep down Scanlan yearns for the one thing he's never known: the true love of a fellow gnome. Still, Scanlan considers himself a lover first, performer second, and fighter distant third. On the battlefield, he'll support his allies, but rarely draws blood, unless it's to protect fellow gnome, Pike. Count on Scanlan for a hearty laugh, a rollicking song, and a twinkle in his eye that melts hearts and makes the females swoon. →",A1,Arc 1: Kraghammer and Vasselheim
20.0,E1, Campaign 1 Episode 1 Arrival at Kraghammer ,ORION,"Greetings and salutations, I am Tiberius Stormwind. I hail from a town called Ty'rex, located in the heart of Draconia, born from a politically respected family. At the age of 15, I succeeded in passing the Sorcerer's Rite, showing prodigy-like control of my magic. The judges and the Draconian high council were amazed at how powerful my spells were for how long I had been training. At 20 years old, I was the youngest appointed member of the magic guild in Draconian history. For the next few years, I almost went mad from the malaise of being a guild member, as it's rather boring. However, one day I happened upon a chamber, unused for quite some time. In the room were stacks of books and maps of the surrounding cities and areas around the known world. For months, I would frequent the chamber, and learned of artifacts from legend. After a long period of research, I made a list of artifacts that caught my eye. I brought these findings to the high council and was told that all of the information in the chamber I had stumbled upon was either believed to be fiction, or unsolvable mysteries, and hence were lost forever. I found those answers to be unacceptable. A year later, I devised a ruse and managed to convince the city council to lend support in me leaving Draconia on a mission of peace and diplomacy for the surrounding kingdoms. →",A1,Arc 1: Kraghammer and Vasselheim
21.0,E1, Campaign 1 Episode 1 Arrival at Kraghammer ,ORION,"Going from town to town and making friends and allies in and for the name of Draconia. Being a red dragonborn, I had quite the task on my hands in that respect, but it was exactly what I needed so I could explore the world and find these artifacts, as I felt the truth was out there. Some may describe me as buffoonish, but I say poppycock to all that. I am much sharper than most give me credit for. I just don't pay attention to things sometimes. I've also been known to be rather cunning, loyal, happy-go-lucky, and well, dangerous. I can't help but show my true scales every now and then. But overall, I think I'm quite friendly for a dragonborn. →",A1,Arc 1: Kraghammer and Vasselheim
22.0,E1, Campaign 1 Episode 1 Arrival at Kraghammer ,LIAM,"Never entirely welcome in the company of elves or men, Vax'ildan learned at a young age to skip past formality, preferring instead to invite himself in your door. Along with twin sister Vex'ahlia, Vax was born by a chance encounter between elven royalty and human peasantry. Raised by their mother in their early years, the twins were eventually sent off to their father in the elven capital of Syngorn. But their cool reception among the elves there never warmed, and their time in the capital didn't last. The siblings stole away one autumn night and set out on the open road. After a few years of wandering, they eventually decided to return to their mother, and journeyed back to the lands of their youth. But instead of finding their childhood home, they returned to a pile of rubble. Their mother was gone, their home burned to ash. Pressing the townspeople for answers, they learned of the day the dragon came. With their ties all severed, Vax'ildan and his sister set out to find their fortune together in Tal'Dorei. An outsider since birth, Vax quickly learned to solve life's challenges in his own particular way, often by sidestepping them entirely. And when his knack for circumventing adversity isn't enough, the way of blades the elves schooled him in more than makes up the difference. →",A1,Arc 1: Kraghammer and Vasselheim
23.0,E1, Campaign 1 Episode 1 Arrival at Kraghammer ,LAURA,"Like so many half-elves, Vex'ahlia has spent most of her life suffering the cool reception of a people who don't fully accept her. →",A1,Arc 1: Kraghammer and Vasselheim
24.0,E1, Campaign 1 Episode 1 Arrival at Kraghammer ,LAURA,"Born of a human mother, and an elven father who only later in life took an interest in their existence, Vex'ahlia and her twin brother, Vax'ildan, quickly realized the only people they could truly rely on in this world were each other. →",A1,Arc 1: Kraghammer and Vasselheim
25.0,E1, Campaign 1 Episode 1 Arrival at Kraghammer ,LAURA,"It was at the age of ten when the two were taken from their mother, and brought to live in Syngorn, the isolated elven city for which their father was an ambassador. He quietly took them in, but always kept an icy distance, and after too many years of disdainful looks, the pair decided to leave his indifference behind, and set out on their own. Vax took to the cities, stealing small trinkets and learning the ways of the thief, while Vex kept to the woods. She preferred the isolation. Always the keen observer, she learned to hunt and to track, to spy and to shoot. Through a series of fateful events, earned herself a companion in the form of a bear-- her own stolen Trinket-- to fight alongside her and protect her fiercely. Also, he is adorable, and gives expert massages. Like so many half-elves-- →",A1,Arc 1: Kraghammer and Vasselheim
26.0,E1, Campaign 1 Episode 1 Arrival at Kraghammer ,MATT,"Hey guys, welcome back. To give you a little heads up, we are playing the 5th edition of Dungeons & Dragons. We recently converted over from Pathfinder, for those who play Pathfinder. →",A1,Arc 1: Kraghammer and Vasselheim
27.0,E1, Campaign 1 Episode 1 Arrival at Kraghammer ,MATT,"One of our players was a gunslinger, for which there are no rules for in 5th edition. So I had to create and customize those for the game, so bear with us on that. That will be an interesting ride, regardless. We do have an eight-player game we've been playing for two years, which is a little crazy, which is why we go a little loose with the rules. It's a great group, it's a lot of fun. Not everyone can make every game, so we have enough players to definitely pull a party each time. →",A1,Arc 1: Kraghammer and Vasselheim
28.0,E1, Campaign 1 Episode 1 Arrival at Kraghammer ,ZAC,"Just so you know, we're having an audio bottleneck. It'll take about 30 seconds to work itself out. →",A1,Arc 1: Kraghammer and Vasselheim
29.0,E1, Campaign 1 Episode 1 Arrival at Kraghammer ,MATT,"Okay, audio bottleneck. →",A1,Arc 1: Kraghammer and Vasselheim
30.0,E1, Campaign 1 Episode 1 Arrival at Kraghammer ,ZAC,Tech problems that make me want to murder someone. →,A1,Arc 1: Kraghammer and Vasselheim
31.0,E1, Campaign 1 Episode 1 Arrival at Kraghammer ,MATT,That's okay. Just a second. You let us know when it's okay to talk. →,A1,Arc 1: Kraghammer and Vasselheim
32.0,E1, Campaign 1 Episode 1 Arrival at Kraghammer ,TRAVIS,"I don't know what that means, a bottleneck. →",A1,Arc 1: Kraghammer and Vasselheim
33.0,E1, Campaign 1 Episode 1 Arrival at Kraghammer ,MATT,Are we all right? And how are we? Exterminate. Exterminate. →,A1,Arc 1: Kraghammer and Vasselheim
34.0,E1, Campaign 1 Episode 1 Arrival at Kraghammer ,SAM,"Nice. Audio isn't working they're going to watch something else. Thanks, douche. →",A1,Arc 1: Kraghammer and Vasselheim
35.0,E1, Campaign 1 Episode 1 Arrival at Kraghammer ,SAM,(laughter) →,A1,Arc 1: Kraghammer and Vasselheim
36.0,E1, Campaign 1 Episode 1 Arrival at Kraghammer ,MATT,Is the mic adjusted? Is it any better? →,A1,Arc 1: Kraghammer and Vasselheim
37.0,E1, Campaign 1 Episode 1 Arrival at Kraghammer ,ZAC,Better now. We're good. →,A1,Arc 1: Kraghammer and Vasselheim
38.0,E1, Campaign 1 Episode 1 Arrival at Kraghammer ,MATT,"Well, great. Thank you guys. A couple of things transitioned from Pathfinder to 5th edition may be a little strange and fun. We have a lot of players, but they're great folks and most of that just means I have to work really hard to make sure the game keeps going, so that's on me. Ashley Johnson, unfortunately, cannot join us. She's our gnome cleric, Pike. She'll be here next week. →",A1,Arc 1: Kraghammer and Vasselheim
39.0,E1, Campaign 1 Episode 1 Arrival at Kraghammer ,MATT,"Unfortunately, she's in London accepting a BAFTA, so I think we're okay. For the Last of Us. That's harsh. Also no donations this week, but going forward we will have donations available for those that will help partially run the show from our wonderful cameraman and crew. Also, half of our donations will go to the 826 charity. Marisha, if you want to talk a little about that. →",A1,Arc 1: Kraghammer and Vasselheim
40.0,E1, Campaign 1 Episode 1 Arrival at Kraghammer ,MARISHA,"Yes! 826LA is a charity that focuses on tutoring children in an after-school program and helping specifically with creativity, storytelling, art and general things that relate to Dungeons & Dragons. You should definitely check out the Time Travel Mart. There is one in Echo Park and one in Mar Vista. They have this amazing storefront where you can buy these awesome tchotchkes and things that go immediately to support the charity and the stream. It's awesome. →",A1,Arc 1: Kraghammer and Vasselheim
41.0,E1, Campaign 1 Episode 1 Arrival at Kraghammer ,MARISHA,"It's 826LA, you should look it up. There's a few all over the country. →",A1,Arc 1: Kraghammer and Vasselheim
42.0,E1, Campaign 1 Episode 1 Arrival at Kraghammer ,MATT,"Yes. Also, as a heads up because I saw some of you guys ask me in the chatroom: These videos will be available on the Geek & Sundry YouTube Channel soon enough, as well as a more extensive backstory of the party. We'll have all that content ready for you so you don't have to memorize it. Maybe a bio page, I don't know. We'll figure something out. It'll be fine. Anyway, let's open that up. You know who I am. Matthew Mercer, voice actor and I've been running this game for two years. I'm a hardcore nerd. Let's go around the table and introduce our players so you can attach the faces to the intros you just saw. Let's start on this side with Travis. →",A1,Arc 1: Kraghammer and Vasselheim
43.0,E1, Campaign 1 Episode 1 Arrival at Kraghammer ,TRAVIS,"Oh! Hi. I'm Travis Willingham, voice actor, gamer. I play Grog the goliath barbarian. →",A1,Arc 1: Kraghammer and Vasselheim
44.0,E1, Campaign 1 Episode 1 Arrival at Kraghammer ,LAURA,"Hi. I'm Laura Bailey. I'm also, you know, a voice actor like everyone here. →",A1,Arc 1: Kraghammer and Vasselheim
45.0,E1, Campaign 1 Episode 1 Arrival at Kraghammer ,TRAVIS,Yeah. I think we all are. →,A1,Arc 1: Kraghammer and Vasselheim
46.0,E1, Campaign 1 Episode 1 Arrival at Kraghammer ,LAURA,I'm playing Vex'ahlia. The coolest chick ever. →,A1,Arc 1: Kraghammer and Vasselheim
47.0,E1, Campaign 1 Episode 1 Arrival at Kraghammer ,MATT,The ranger with the bear. →,A1,Arc 1: Kraghammer and Vasselheim
48.0,E1, Campaign 1 Episode 1 Arrival at Kraghammer ,LAURA,"The ranger with the bear named Trinket, in case you didn't catch that. His name is Trinket and he's amazing. →",A1,Arc 1: Kraghammer and Vasselheim
49.0,E1, Campaign 1 Episode 1 Arrival at Kraghammer ,LIAM,"Hi, I'm Liam O'Brien. I'm playing Vax'ildan. →",A1,Arc 1: Kraghammer and Vasselheim
50.0,E1, Campaign 1 Episode 1 Arrival at Kraghammer ,LIAM,This one's twin. We're half-elven twins. I started playing D&D when I was 13 and I can't believe this is happening. So cheers. Cheers to this. →,A1,Arc 1: Kraghammer and Vasselheim
51.0,E1, Campaign 1 Episode 1 Arrival at Kraghammer ,TALIESIN,"My name is Taliesin Jaffe. I'm a voice actor, director, and I've been playing some form of Dungeons & Dragons, and if you can't tell by my black clothing, a lot of Vampire the Masquerade when I was a teenager. →",A1,Arc 1: Kraghammer and Vasselheim
52.0,E1, Campaign 1 Episode 1 Arrival at Kraghammer ,TALIESIN,"There was a problem. I'm playing Percy, the Gunslinger. I'm the reason all the rules are all messed up. →",A1,Arc 1: Kraghammer and Vasselheim
53.0,E1, Campaign 1 Episode 1 Arrival at Kraghammer ,MARISHA,"I am Keyleth, the druid from the tribe of the Air Ashari. I am a half-elven person. →",A1,Arc 1: Kraghammer and Vasselheim
54.0,E1, Campaign 1 Episode 1 Arrival at Kraghammer ,MATT,"No, you're elven. →",A1,Arc 1: Kraghammer and Vasselheim
55.0,E1, Campaign 1 Episode 1 Arrival at Kraghammer ,MARISHA,"No, half-elf. →",A1,Arc 1: Kraghammer and Vasselheim
56.0,E1, Campaign 1 Episode 1 Arrival at Kraghammer ,MATT,Half-elf. Okay. →,A1,Arc 1: Kraghammer and Vasselheim
57.0,E1, Campaign 1 Episode 1 Arrival at Kraghammer ,MARISHA,"Yeah, Come on, man. I've been half-elf since day one. Half-elven. Yes! You can see me shooting lightning and turning into awesome animals. →",A1,Arc 1: Kraghammer and Vasselheim
58.0,E1, Campaign 1 Episode 1 Arrival at Kraghammer ,MATT,Orion. →,A1,Arc 1: Kraghammer and Vasselheim
59.0,E1, Campaign 1 Episode 1 Arrival at Kraghammer ,ORION,Hi. →,A1,Arc 1: Kraghammer and Vasselheim
60.0,E1, Campaign 1 Episode 1 Arrival at Kraghammer ,ORION,"Hey, everybody. I'm Orion Acaba and I'm also a voice actor. I do things. →",A1,Arc 1: Kraghammer and Vasselheim
61.0,E1, Campaign 1 Episode 1 Arrival at Kraghammer ,MARISHA,"Oh, I'm Marisha Ray, by the way. →",A1,Arc 1: Kraghammer and Vasselheim
62.0,E1, Campaign 1 Episode 1 Arrival at Kraghammer ,ORION,Yeah! →,A1,Arc 1: Kraghammer and Vasselheim
63.0,E1, Campaign 1 Episode 1 Arrival at Kraghammer ,MARISHA,Did I say that? →,A1,Arc 1: Kraghammer and Vasselheim
64.0,E1, Campaign 1 Episode 1 Arrival at Kraghammer ,ORION,Keyleth is Marisha Ray. →,A1,Arc 1: Kraghammer and Vasselheim
65.0,E1, Campaign 1 Episode 1 Arrival at Kraghammer ,MATT,Let Orion have his moment. Don't try and break-- →,A1,Arc 1: Kraghammer and Vasselheim
66.0,E1, Campaign 1 Episode 1 Arrival at Kraghammer ,ORION,"No, it's our moment. →",A1,Arc 1: Kraghammer and Vasselheim
67.0,E1, Campaign 1 Episode 1 Arrival at Kraghammer ,MATT,There you go. All right. →,A1,Arc 1: Kraghammer and Vasselheim
68.0,E1, Campaign 1 Episode 1 Arrival at Kraghammer ,ORION,I'm Tiberius the awesome sorcerer. →,A1,Arc 1: Kraghammer and Vasselheim
69.0,E1, Campaign 1 Episode 1 Arrival at Kraghammer ,MATT,Dragonborn sorcerer. →,A1,Arc 1: Kraghammer and Vasselheim
70.0,E1, Campaign 1 Episode 1 Arrival at Kraghammer ,ORION,"Dragonborn, yeah! That's right. →",A1,Arc 1: Kraghammer and Vasselheim
71.0,E1, Campaign 1 Episode 1 Arrival at Kraghammer ,SAM,"I'm Sam Riegel: a voice actor, and stuff. My character is Scanlan Shorthalt. The gnome bard who sings a lot. Let's start playing, yeah? (cheering) →",A1,Arc 1: Kraghammer and Vasselheim
72.0,E1, Campaign 1 Episode 1 Arrival at Kraghammer ,MATT,"All right! Let's jump on in. Thank you. Last we left off, to give you a little backstory. The party had completed a large venture in saving the nearby city of Emon. One of the central capitals of this human civilization of Tal'Dorei. They managed to halt a demonic insurrection within the throne and as such were greeted to a hero's celebration and had a keep built in their honor. →",A1,Arc 1: Kraghammer and Vasselheim
73.0,E1, Campaign 1 Episode 1 Arrival at Kraghammer ,MATT,"Over the six month period of the keep being constructed, they went their own ways and then returned to see its final creation. However, they did not have a chance to really enjoy it immediately as one of their good friends and allies, Arcanist Allura Vysoren of the Tal'Dorei council came to them requesting their aid saying that a long time friend of hers, Lady Kima of Vord, who is a very well known and very well respected halfling paladin of Bahamut, the Platinum Dragon, had been gone on a pilgrimage for a while, essentially a vision quest that is part of her own development as a paladin. As part of this, she let the information go to Allura that a dark vision had come to her saying that some sort of evil root is beginning to breed beneath Kraghammer and the mountains within Kraghammer, which is the nearby dwarven civilization that you guys have previously not been allowed entry to because the dwarves weren't fans of nobody without any political means of entry. However, she managed to acquire the necessary documentation and offered you a very substantial reward should you find the whereabouts of Lady Kima of Vord and hopefully bring her back safely. You left on the pathway to the dwarven citadel of Kraghammer. You were ambushed by a group of roaming barbarian goliaths. →",A1,Arc 1: Kraghammer and Vasselheim
74.0,E1, Campaign 1 Episode 1 Arrival at Kraghammer ,MATT,"Part way through the battle, Grog managed to recognize one of them as a previous ally and no longer an ally at this time. →",A1,Arc 1: Kraghammer and Vasselheim
75.0,E1, Campaign 1 Episode 1 Arrival at Kraghammer ,TRAVIS,Son of a bitch. →,A1,Arc 1: Kraghammer and Vasselheim
76.0,E1, Campaign 1 Episode 1 Arrival at Kraghammer ,MATT,"Yep, the barbarian for his first and only time so far managed to avert battle through a social encounter and rolled pretty damn well on a persuasion check. So you got one. You get one. You got your one. Never again. →",A1,Arc 1: Kraghammer and Vasselheim
