line #,episode #,episode,name,line,arc #,arc
1167.0,E1, Campaign 1 Episode 1 Arrival at Kraghammer ,TALIESIN,"Together they fled, chased by the Briarwoods' men. →",A1,Arc 1: Kraghammer and Vasselheim
1168.0,E1, Campaign 1 Episode 1 Arrival at Kraghammer ,TALIESIN,"As they ran, Percy's sister took several arrows to the chest and fell. Percy kept running, eventually jumping into a freezing river and floating unconscious to freedom. He did not remember waking up on a fishing boat. He barely remembered the next two years, as he slowly made his way as far south as possible. Then one night, Percy had a dream. A roaring cloud of smoke offered him vengeance against those who destroyed his family. →",A1,Arc 1: Kraghammer and Vasselheim
1169.0,E1, Campaign 1 Episode 1 Arrival at Kraghammer ,TALIESIN,"When he awoke, Percy began to design his first gun. →",A1,Arc 1: Kraghammer and Vasselheim
1170.0,E1, Campaign 1 Episode 1 Arrival at Kraghammer ,SAM,"Oh, you haven't heard of Scanlan Shorthalt? Well, gird your loins, ladies, because he has his eye on you. A talented musician, master of disguise, and dashingly handsome in his own mind, Scanlan sings songs almost as much as he sings his own praises. Born a poor gnome, Scanlan used his endless charm and soaring tenor voice to croon for coin and support his single mother. One day, he was discovered by a half-orc promoter, and joined Dr. Dranzel's Spectacular Traveling Troupe where he learned the ways of the world, and honed his skills as a bard extraordinaire. A loner much of his life, Scanlan has never quite come to terms with the violent death of his mother at the hands of a goblin invasion. While his years on the road provided many, shall we say, educational experiences with the opposite sex, deep down Scanlan yearns for the one thing he's never known: the true love of a fellow gnome. Still, Scanlan considers himself a lover first, performer second, and fighter distant third. On the battlefield, he'll support his allies, but rarely draws blood, unless it's to protect fellow gnome, Pike. Count on Scanlan for a hearty laugh, a rollicking song, and a twinkle in his eye that melts hearts and makes the females swoon. →",A1,Arc 1: Kraghammer and Vasselheim
1171.0,E1, Campaign 1 Episode 1 Arrival at Kraghammer ,ORION,"Greetings and salutations, I am Tiberius Stormwind. I hail from a town called Ty'rex, located in the heart of Draconia, born from a politically respected family. At the age of 15, I succeeded in passing the Sorcerer's Rite, showing prodigy-like control of my magic. The judges and the Draconian high council were amazed at how powerful my spells were for how long I had been training. At 20 years old, I was the youngest appointed member of the magic guild in Draconian history. For the next few years, I almost went mad from the malaise of being a guild member, as it's rather boring. However, one day I happened upon a chamber, unused for quite some time. In the room were stacks of books and maps of the surrounding cities and areas around the known world. For months, I would frequent the chamber, and learned of artifacts from legend. After a long period of research, I made a list of artifacts that caught my eye. I brought these findings to the high council and was told that all of the information in the chamber I had stumbled upon was either believed to be fiction, or unsolvable mysteries, and hence were lost forever. I found those answers to be unacceptable. A year later, I devised a ruse and managed to convince the city council to lend support in me leaving Draconia on a mission of peace and diplomacy for the surrounding kingdoms. →",A1,Arc 1: Kraghammer and Vasselheim
1172.0,E1, Campaign 1 Episode 1 Arrival at Kraghammer ,ORION,"Going from town to town and making friends and allies in and for the name of Draconia. Being a red dragonborn, I had quite the task on my hands in that respect, but it was exactly what I needed so I could explore the world and find these artifacts, as I felt the truth was out there. Some may describe me as buffoonish, but I say poppycock to all that. I am much sharper than most give me credit for. I just don't pay attention to things sometimes. I've also been known to be rather cunning, loyal, happy-go-lucky, and well, dangerous. I can't help but show my true scales every now and then. But overall, I think I'm quite friendly for a dragonborn. →",A1,Arc 1: Kraghammer and Vasselheim
1173.0,E1, Campaign 1 Episode 1 Arrival at Kraghammer ,LIAM,"Never entirely welcome in the company of elves or men, Vax'ildan learned at a young age to skip past formality, preferring instead to invite himself in your door. Along with twin sister Vex'ahlia, Vax was born by a chance encounter between elven royalty and human peasantry. Raised by their mother in their early years, the twins were eventually sent off to their father in the elven capital of Syngorn. But their cool reception among the elves there never warmed, and their time in the capital didn't last. The siblings stole away one autumn night and set out on the open road. After a few years of wandering, they eventually decided to return to their mother, and journeyed back to the lands of their youth. But instead of finding their childhood home, they returned to a pile of rubble. Their mother was gone, their home burned to ash. Pressing the townspeople for answers, they learned of the day the dragon came. With their ties all severed, Vax'ildan and his sister set out to find their fortune together in Tal'Dorei. An outsider since birth, Vax quickly learned to solve life's challenges in his own particular way, often by sidestepping them entirely. And when his knack for circumventing adversity isn't enough, the way of blades the elves schooled him in more than makes up the difference. →",A1,Arc 1: Kraghammer and Vasselheim
1174.0,E1, Campaign 1 Episode 1 Arrival at Kraghammer ,LAURA,"Like so many half-elves, Vex'ahlia has spent most of her life suffering the cool reception of a people who don't fully accept her. →",A1,Arc 1: Kraghammer and Vasselheim
1175.0,E1, Campaign 1 Episode 1 Arrival at Kraghammer ,LAURA,"Born of a human mother, and an elven father who only later in life took an interest in their existence, Vex'ahlia and her twin brother, Vax'ildan, quickly realized the only people they could truly rely on in this world were each other. →",A1,Arc 1: Kraghammer and Vasselheim
1176.0,E1, Campaign 1 Episode 1 Arrival at Kraghammer ,LAURA,"It was at the age of ten when the two were taken from their mother, and brought to live in Syngorn, the isolated elven city for which their father was an ambassador. He quietly took them in, but always kept an icy distance, and after too many years of disdainful looks, the pair decided to leave his indifference behind, and set out on their own. Vax took to the cities, stealing small trinkets and learning the ways of the thief, while Vex kept to the woods. She preferred the isolation. Always the keen observer, she learned to hunt and to track, to spy and to shoot. Through a series of fateful events, earned herself a companion in the form of a bear-- her own stolen Trinket-- to fight alongside her and protect her fiercely. Also, he is adorable, and gives expert massages. →",A1,Arc 1: Kraghammer and Vasselheim
1177.0,E1, Campaign 1 Episode 1 Arrival at Kraghammer ,MATT,"Hello, everyone. Welcome back. We've had our pee breaks. We've had our refills of our drinks. →",A1,Arc 1: Kraghammer and Vasselheim
1178.0,E1, Campaign 1 Episode 1 Arrival at Kraghammer ,MATT,"We've got Fireball, so I think we're good for the next venture. Anyway, the party has taken their rest for the evening. Once again, this is one of those weird experiences where you wake up, not because of the sun rising, because you can't see it in the dwarven city of Kraghammer, but eventually you all come to consciousness naturally. What is your plan of action? →",A1,Arc 1: Kraghammer and Vasselheim
1179.0,E1, Campaign 1 Episode 1 Arrival at Kraghammer ,SAM,"Oh, Jesus, we should have all talked about this while we were all peeing. →",A1,Arc 1: Kraghammer and Vasselheim
1180.0,E1, Campaign 1 Episode 1 Arrival at Kraghammer ,TRAVIS,"We're going to beat up everybody, right? →",A1,Arc 1: Kraghammer and Vasselheim
1181.0,E1, Campaign 1 Episode 1 Arrival at Kraghammer ,SAM,Are we going to the manor? →,A1,Arc 1: Kraghammer and Vasselheim
1182.0,E1, Campaign 1 Episode 1 Arrival at Kraghammer ,TALIESIN,"I say we have brunch, and we go to the manor-- →",A1,Arc 1: Kraghammer and Vasselheim
1183.0,E1, Campaign 1 Episode 1 Arrival at Kraghammer ,LAURA,Brunch? →,A1,Arc 1: Kraghammer and Vasselheim
1184.0,E1, Campaign 1 Episode 1 Arrival at Kraghammer ,SAM,Eggs benedict. →,A1,Arc 1: Kraghammer and Vasselheim
1185.0,E1, Campaign 1 Episode 1 Arrival at Kraghammer ,TALIESIN,I want dwarven brunch. →,A1,Arc 1: Kraghammer and Vasselheim
1186.0,E1, Campaign 1 Episode 1 Arrival at Kraghammer ,LIAM,I want a traditional dwarven breakfast. →,A1,Arc 1: Kraghammer and Vasselheim
1187.0,E1, Campaign 1 Episode 1 Arrival at Kraghammer ,MARISHA,Dwarven eggs are very good. →,A1,Arc 1: Kraghammer and Vasselheim
1188.0,E1, Campaign 1 Episode 1 Arrival at Kraghammer ,TALIESIN,They're small. →,A1,Arc 1: Kraghammer and Vasselheim
1189.0,E1, Campaign 1 Episode 1 Arrival at Kraghammer ,MATT,"Okay, so Tiberius fills you all in about his experience, trying to get into the House Thunderbrand. →",A1,Arc 1: Kraghammer and Vasselheim
1190.0,E1, Campaign 1 Episode 1 Arrival at Kraghammer ,TRAVIS,How you almost got killed? →,A1,Arc 1: Kraghammer and Vasselheim
1191.0,E1, Campaign 1 Episode 1 Arrival at Kraghammer ,ORION,"I didn't, certainly not. I just couldn't get in the door. Rather rude! →",A1,Arc 1: Kraghammer and Vasselheim
1192.0,E1, Campaign 1 Episode 1 Arrival at Kraghammer ,MARISHA,Why did you think that after the magic hand failed that the big thunder ice wave would work? →,A1,Arc 1: Kraghammer and Vasselheim
1193.0,E1, Campaign 1 Episode 1 Arrival at Kraghammer ,ORION,What I thought is that I could cover the rune with ice and merely step over it. I didn't think it would dissolve my ice. →,A1,Arc 1: Kraghammer and Vasselheim
1194.0,E1, Campaign 1 Episode 1 Arrival at Kraghammer ,TRAVIS,Did you sleep? →,A1,Arc 1: Kraghammer and Vasselheim
1195.0,E1, Campaign 1 Episode 1 Arrival at Kraghammer ,ORION,Yes. →,A1,Arc 1: Kraghammer and Vasselheim
1196.0,E1, Campaign 1 Episode 1 Arrival at Kraghammer ,TRAVIS,"Oh. I had to make sure, you know. →",A1,Arc 1: Kraghammer and Vasselheim
1197.0,E1, Campaign 1 Episode 1 Arrival at Kraghammer ,ORION,"A good sorcerer always all his tricks before turning around, which is what I did. I think we should go back there because I feel that it's significant that I couldn't get in so easily. →",A1,Arc 1: Kraghammer and Vasselheim
1198.0,E1, Campaign 1 Episode 1 Arrival at Kraghammer ,TALIESIN,We will go back there. I don't think it's the next order of business but I think that we're not leaving the city without dealing with that. →,A1,Arc 1: Kraghammer and Vasselheim
1199.0,E1, Campaign 1 Episode 1 Arrival at Kraghammer ,LAURA,Definitely. →,A1,Arc 1: Kraghammer and Vasselheim
1200.0,E1, Campaign 1 Episode 1 Arrival at Kraghammer ,TRAVIS,Do we need to do something with the comment cards? →,A1,Arc 1: Kraghammer and Vasselheim
1201.0,E1, Campaign 1 Episode 1 Arrival at Kraghammer ,LAURA,Oh. →,A1,Arc 1: Kraghammer and Vasselheim
1202.0,E1, Campaign 1 Episode 1 Arrival at Kraghammer ,TALIESIN,Did you not fill out your comment card? →,A1,Arc 1: Kraghammer and Vasselheim
1203.0,E1, Campaign 1 Episode 1 Arrival at Kraghammer ,TRAVIS,"No, I did! I know, like, three letters, so like A, F, and A. →",A1,Arc 1: Kraghammer and Vasselheim
1204.0,E1, Campaign 1 Episode 1 Arrival at Kraghammer ,MARISHA,That's okay. →,A1,Arc 1: Kraghammer and Vasselheim
1205.0,E1, Campaign 1 Episode 1 Arrival at Kraghammer ,TALIESIN,That sounds very positive. →,A1,Arc 1: Kraghammer and Vasselheim
1206.0,E1, Campaign 1 Episode 1 Arrival at Kraghammer ,MARISHA,"It's the thought that counts, Grog. It's the thought that counts. →",A1,Arc 1: Kraghammer and Vasselheim
1207.0,E1, Campaign 1 Episode 1 Arrival at Kraghammer ,LAURA,Did you put a smiley face next to the A-F-A? →,A1,Arc 1: Kraghammer and Vasselheim
1208.0,E1, Campaign 1 Episode 1 Arrival at Kraghammer ,TRAVIS,I covered my hand in ink. →,A1,Arc 1: Kraghammer and Vasselheim
1209.0,E1, Campaign 1 Episode 1 Arrival at Kraghammer ,LAURA,That works. →,A1,Arc 1: Kraghammer and Vasselheim
1210.0,E1, Campaign 1 Episode 1 Arrival at Kraghammer ,TALIESIN,Very good. I think that went well. →,A1,Arc 1: Kraghammer and Vasselheim
1211.0,E1, Campaign 1 Episode 1 Arrival at Kraghammer ,SAM,"Shall we try to make our way to the manor, then? →",A1,Arc 1: Kraghammer and Vasselheim
1212.0,E1, Campaign 1 Episode 1 Arrival at Kraghammer ,LAURA,"The Greyspine Manor, with our cask of fancy ale/wine. →",A1,Arc 1: Kraghammer and Vasselheim
1213.0,E1, Campaign 1 Episode 1 Arrival at Kraghammer ,TRAVIS,Does the light ever change being underground? →,A1,Arc 1: Kraghammer and Vasselheim
1214.0,E1, Campaign 1 Episode 1 Arrival at Kraghammer ,MATT,"No, it is a perpetual low red glow from all the stones that are embedded around the streets. →",A1,Arc 1: Kraghammer and Vasselheim
1215.0,E1, Campaign 1 Episode 1 Arrival at Kraghammer ,MATT,LAURA:I feel really sleepy and also very awake at the same time. →,A1,Arc 1: Kraghammer and Vasselheim
1216.0,E1, Campaign 1 Episode 1 Arrival at Kraghammer ,MARISHA,"Yeah, I know. →",A1,Arc 1: Kraghammer and Vasselheim
1217.0,E1, Campaign 1 Episode 1 Arrival at Kraghammer ,MATT,"Oh, dwarves. →",A1,Arc 1: Kraghammer and Vasselheim
1218.0,E1, Campaign 1 Episode 1 Arrival at Kraghammer ,LAURA,So what do you think? →,A1,Arc 1: Kraghammer and Vasselheim
1219.0,E1, Campaign 1 Episode 1 Arrival at Kraghammer ,TALIESIN,Now I'm curious if there's dwarven coffee. →,A1,Arc 1: Kraghammer and Vasselheim
1220.0,E1, Campaign 1 Episode 1 Arrival at Kraghammer ,MATT,"You guys make your way after your brunch, your delicious dwarven brunch-- →",A1,Arc 1: Kraghammer and Vasselheim
1221.0,E1, Campaign 1 Episode 1 Arrival at Kraghammer ,TALIESIN,Thank you! →,A1,Arc 1: Kraghammer and Vasselheim
1222.0,E1, Campaign 1 Episode 1 Arrival at Kraghammer ,MATT,-- which is very alcoholic. →,A1,Arc 1: Kraghammer and Vasselheim
1223.0,E1, Campaign 1 Episode 1 Arrival at Kraghammer ,TRAVIS,Yes! →,A1,Arc 1: Kraghammer and Vasselheim
1224.0,E1, Campaign 1 Episode 1 Arrival at Kraghammer ,TALIESIN,"It's like being in New Orleans for the weekend, every meal is going to come with something alcoholic. →",A1,Arc 1: Kraghammer and Vasselheim
1225.0,E1, Campaign 1 Episode 1 Arrival at Kraghammer ,LAURA,You're turning yourself into a dwarf? →,A1,Arc 1: Kraghammer and Vasselheim
1226.0,E1, Campaign 1 Episode 1 Arrival at Kraghammer ,SAM,Did you catch that? He just turned himself into a dwarf. →,A1,Arc 1: Kraghammer and Vasselheim
1227.0,E1, Campaign 1 Episode 1 Arrival at Kraghammer ,TRAVIS,You did? →,A1,Arc 1: Kraghammer and Vasselheim
1228.0,E1, Campaign 1 Episode 1 Arrival at Kraghammer ,MATT,Tiberius went (whoosh) into a dwarven form. →,A1,Arc 1: Kraghammer and Vasselheim
1229.0,E1, Campaign 1 Episode 1 Arrival at Kraghammer ,LAURA,What kind of dwarf? What do you look like? →,A1,Arc 1: Kraghammer and Vasselheim
1230.0,E1, Campaign 1 Episode 1 Arrival at Kraghammer ,SAM,He's very handsome for a dwarf. →,A1,Arc 1: Kraghammer and Vasselheim
1231.0,E1, Campaign 1 Episode 1 Arrival at Kraghammer ,LAURA,Are you a girl dwarf? →,A1,Arc 1: Kraghammer and Vasselheim
1232.0,E1, Campaign 1 Episode 1 Arrival at Kraghammer ,MARISHA,Yes! You should be a lady dwarf. →,A1,Arc 1: Kraghammer and Vasselheim
1233.0,E1, Campaign 1 Episode 1 Arrival at Kraghammer ,SAM,"Oh yeah, what kind of dwarf? A lady dwarf? →",A1,Arc 1: Kraghammer and Vasselheim
1234.0,E1, Campaign 1 Episode 1 Arrival at Kraghammer ,ORION,I would not do that again. →,A1,Arc 1: Kraghammer and Vasselheim
1235.0,E1, Campaign 1 Episode 1 Arrival at Kraghammer ,TRAVIS,"Oh, you did do that, you did take it as a troll. →",A1,Arc 1: Kraghammer and Vasselheim
1236.0,E1, Campaign 1 Episode 1 Arrival at Kraghammer ,ORION,Almost! She shot off the penis. →,A1,Arc 1: Kraghammer and Vasselheim
1237.0,E1, Campaign 1 Episode 1 Arrival at Kraghammer ,LIAM,What is going on? →,A1,Arc 1: Kraghammer and Vasselheim
1238.0,E1, Campaign 1 Episode 1 Arrival at Kraghammer ,TRAVIS,That's where the troll dick came from. →,A1,Arc 1: Kraghammer and Vasselheim
1239.0,E1, Campaign 1 Episode 1 Arrival at Kraghammer ,ORION,"Don't you remember, Vax? I was almost raped by trolls. →",A1,Arc 1: Kraghammer and Vasselheim
1240.0,E1, Campaign 1 Episode 1 Arrival at Kraghammer ,MATT,There was a cavern interaction with two male trolls that they had stealthed up behind as a party. I love explaining this to the audience. →,A1,Arc 1: Kraghammer and Vasselheim
1241.0,E1, Campaign 1 Episode 1 Arrival at Kraghammer ,MATT,"Tiberius then polymorphed into a female troll to try and Bugs Bunny them, not realizing that dwarves who are underground and-- →",A1,Arc 1: Kraghammer and Vasselheim
1242.0,E1, Campaign 1 Episode 1 Arrival at Kraghammer ,LAURA,Trolls. →,A1,Arc 1: Kraghammer and Vasselheim
1243.0,E1, Campaign 1 Episode 1 Arrival at Kraghammer ,MATT,"--trolls don't encounter female trolls often enough to have a one track mind. He nearly got himself in a very bad situation. That was remedied by the party attacking and Vex over here shooting off the troll's dick. Which then went in the bag of holding, which is disgusting. →",A1,Arc 1: Kraghammer and Vasselheim
1244.0,E1, Campaign 1 Episode 1 Arrival at Kraghammer ,MARISHA,That's also where the hashtag not all trolls came from. →,A1,Arc 1: Kraghammer and Vasselheim
1245.0,E1, Campaign 1 Episode 1 Arrival at Kraghammer ,MATT,"Yup, hashtag not all trolls came from that game. That is horrible. →",A1,Arc 1: Kraghammer and Vasselheim
1246.0,E1, Campaign 1 Episode 1 Arrival at Kraghammer ,TALIESIN,Oh god. Bring it back. →,A1,Arc 1: Kraghammer and Vasselheim
1247.0,E1, Campaign 1 Episode 1 Arrival at Kraghammer ,MARISHA,Bringing it back. →,A1,Arc 1: Kraghammer and Vasselheim
1248.0,E1, Campaign 1 Episode 1 Arrival at Kraghammer ,MATT,"You guys make your way to the residential district. The same guards are there who were there the previous night that encountered you guys so, as you roll up with an entourage- →",A1,Arc 1: Kraghammer and Vasselheim
1249.0,E1, Campaign 1 Episode 1 Arrival at Kraghammer ,SAM,How many are there? →,A1,Arc 1: Kraghammer and Vasselheim
1250.0,E1, Campaign 1 Episode 1 Arrival at Kraghammer ,MATT,"Currently, there are four. →",A1,Arc 1: Kraghammer and Vasselheim
1251.0,E1, Campaign 1 Episode 1 Arrival at Kraghammer ,TRAVIS,We can take them. →,A1,Arc 1: Kraghammer and Vasselheim
1252.0,E1, Campaign 1 Episode 1 Arrival at Kraghammer ,LAURA,Hi. I wave at Thompson. →,A1,Arc 1: Kraghammer and Vasselheim
1253.0,E1, Campaign 1 Episode 1 Arrival at Kraghammer ,MATT,He's actually not there. It's the two others that were with you. He is noticeably absent. →,A1,Arc 1: Kraghammer and Vasselheim
1254.0,E1, Campaign 1 Episode 1 Arrival at Kraghammer ,LAURA,Oh. Where's Thompson? →,A1,Arc 1: Kraghammer and Vasselheim
1255.0,E1, Campaign 1 Episode 1 Arrival at Kraghammer ,MATT,"They look at each other and they're like, ""He's been given the day off."" →",A1,Arc 1: Kraghammer and Vasselheim
1256.0,E1, Campaign 1 Episode 1 Arrival at Kraghammer ,LAURA,"Oh, really? →",A1,Arc 1: Kraghammer and Vasselheim
1257.0,E1, Campaign 1 Episode 1 Arrival at Kraghammer ,LIAM,"As you can see, we brought one of your citizens with us to show us a tour of the city. →",A1,Arc 1: Kraghammer and Vasselheim
1258.0,E1, Campaign 1 Episode 1 Arrival at Kraghammer ,SAM,That's you. →,A1,Arc 1: Kraghammer and Vasselheim
1259.0,E1, Campaign 1 Episode 1 Arrival at Kraghammer ,MATT,"""Citizen? I haven't see you about. What's your name?"" →",A1,Arc 1: Kraghammer and Vasselheim
1260.0,E1, Campaign 1 Episode 1 Arrival at Kraghammer ,ORION,"Oh, my name is Tiberius Kraghammer. →",A1,Arc 1: Kraghammer and Vasselheim
1261.0,E1, Campaign 1 Episode 1 Arrival at Kraghammer ,ORION,(laughter) →,A1,Arc 1: Kraghammer and Vasselheim
1262.0,E1, Campaign 1 Episode 1 Arrival at Kraghammer ,SAM,Like Johnny New York. →,A1,Arc 1: Kraghammer and Vasselheim
1263.0,E1, Campaign 1 Episode 1 Arrival at Kraghammer ,ORION,"Shoot, we're in Kraghammer, right? →",A1,Arc 1: Kraghammer and Vasselheim
1264.0,E1, Campaign 1 Episode 1 Arrival at Kraghammer ,SAM,We're in Kraghammer. →,A1,Arc 1: Kraghammer and Vasselheim
1265.0,E1, Campaign 1 Episode 1 Arrival at Kraghammer ,ORION,"Oh, Stronghammer. →",A1,Arc 1: Kraghammer and Vasselheim
1266.0,E1, Campaign 1 Episode 1 Arrival at Kraghammer ,SAM,Johnny New York. →,A1,Arc 1: Kraghammer and Vasselheim
1267.0,E1, Campaign 1 Episode 1 Arrival at Kraghammer ,MATT,"""What is it, Kraghammer, or what was it?"" (laughter) →",A1,Arc 1: Kraghammer and Vasselheim
1268.0,E1, Campaign 1 Episode 1 Arrival at Kraghammer ,ORION,I meant--I meant Stronghammer. Kraghammer is my father's cousin's side. →,A1,Arc 1: Kraghammer and Vasselheim
1269.0,E1, Campaign 1 Episode 1 Arrival at Kraghammer ,MATT,"""How drunk are you?"" →",A1,Arc 1: Kraghammer and Vasselheim
1270.0,E1, Campaign 1 Episode 1 Arrival at Kraghammer ,ORION,I've been drinking since I've woken. →,A1,Arc 1: Kraghammer and Vasselheim
1271.0,E1, Campaign 1 Episode 1 Arrival at Kraghammer ,MATT,Make a persuasion check. →,A1,Arc 1: Kraghammer and Vasselheim
1272.0,E1, Campaign 1 Episode 1 Arrival at Kraghammer ,SAM,"See, he is one of you! →",A1,Arc 1: Kraghammer and Vasselheim
1273.0,E1, Campaign 1 Episode 1 Arrival at Kraghammer ,TRAVIS,I had a lot of breakfast. →,A1,Arc 1: Kraghammer and Vasselheim
1274.0,E1, Campaign 1 Episode 1 Arrival at Kraghammer ,ORION,"Oh yay, 19. →",A1,Arc 1: Kraghammer and Vasselheim
1275.0,E1, Campaign 1 Episode 1 Arrival at Kraghammer ,MATT,19. →,A1,Arc 1: Kraghammer and Vasselheim
1276.0,E1, Campaign 1 Episode 1 Arrival at Kraghammer ,TRAVIS,Tiberius Kraghammer. →,A1,Arc 1: Kraghammer and Vasselheim
1277.0,E1, Campaign 1 Episode 1 Arrival at Kraghammer ,MATT,"""All right, I haven't seen you around, but obviously it's a bit early to be that fucked up."" →",A1,Arc 1: Kraghammer and Vasselheim
1278.0,E1, Campaign 1 Episode 1 Arrival at Kraghammer ,ORION,"I've been very depressed, you know. →",A1,Arc 1: Kraghammer and Vasselheim
1279.0,E1, Campaign 1 Episode 1 Arrival at Kraghammer ,MATT,"Well, what's your business, if I might ask again? You already seen the statue. →",A1,Arc 1: Kraghammer and Vasselheim
1280.0,E1, Campaign 1 Episode 1 Arrival at Kraghammer ,LAURA,"Yeah, we saw the statue, but we wanted to get a better look at it. We brought this gift for the Greyspines and we wanted to present it to them. →",A1,Arc 1: Kraghammer and Vasselheim
1281.0,E1, Campaign 1 Episode 1 Arrival at Kraghammer ,MATT,"The two new Carvers step forward and look at it. ""Ooh!"" →",A1,Arc 1: Kraghammer and Vasselheim
1282.0,E1, Campaign 1 Episode 1 Arrival at Kraghammer ,LAURA,It's really nice. →,A1,Arc 1: Kraghammer and Vasselheim
1283.0,E1, Campaign 1 Episode 1 Arrival at Kraghammer ,MATT,"One of them's like, ""I'll tell you what. If you let us taste a bit of that, we'll let you go."" →",A1,Arc 1: Kraghammer and Vasselheim
1284.0,E1, Campaign 1 Episode 1 Arrival at Kraghammer ,ORION,"Oh, I mean, I've been drinking a lot of it, sure! →",A1,Arc 1: Kraghammer and Vasselheim
1285.0,E1, Campaign 1 Episode 1 Arrival at Kraghammer ,LAURA,A thimble of it because if any of it goes missing-- Is it sealed? Can we tell if it's sealed? →,A1,Arc 1: Kraghammer and Vasselheim
1286.0,E1, Campaign 1 Episode 1 Arrival at Kraghammer ,MATT,You look at it. It does not have any sort of port or exit on it. It is just a solid barrel. →,A1,Arc 1: Kraghammer and Vasselheim
1287.0,E1, Campaign 1 Episode 1 Arrival at Kraghammer ,ORION,"Maybe, we can save some for them. →",A1,Arc 1: Kraghammer and Vasselheim
1288.0,E1, Campaign 1 Episode 1 Arrival at Kraghammer ,ORION,"LAURA:. If we open it, it'll ruin the barrel, right? →",A1,Arc 1: Kraghammer and Vasselheim
1289.0,E1, Campaign 1 Episode 1 Arrival at Kraghammer ,MATT,"""Ah, that's right."" →",A1,Arc 1: Kraghammer and Vasselheim
1290.0,E1, Campaign 1 Episode 1 Arrival at Kraghammer ,LAURA,Maybe we can save you a bottle of it when we open it inside. We'll give it to you later. →,A1,Arc 1: Kraghammer and Vasselheim
1291.0,E1, Campaign 1 Episode 1 Arrival at Kraghammer ,MATT,Make a persuasion check for that. It's a very persuasion based encounter. →,A1,Arc 1: Kraghammer and Vasselheim
1292.0,E1, Campaign 1 Episode 1 Arrival at Kraghammer ,LAURA,Should I roll that one that failed me earlier or my little dice? →,A1,Arc 1: Kraghammer and Vasselheim
1293.0,E1, Campaign 1 Episode 1 Arrival at Kraghammer ,MATT,The little dice! They haven't come out yet! →,A1,Arc 1: Kraghammer and Vasselheim
1294.0,E1, Campaign 1 Episode 1 Arrival at Kraghammer ,LAURA,"(high-pitched) My little, tiny dice. →",A1,Arc 1: Kraghammer and Vasselheim
1295.0,E1, Campaign 1 Episode 1 Arrival at Kraghammer ,MATT,Itty bitty dice. →,A1,Arc 1: Kraghammer and Vasselheim
1296.0,E1, Campaign 1 Episode 1 Arrival at Kraghammer ,LAURA,"Teeny tiny dice. Okay that's better, I rolled a 23. →",A1,Arc 1: Kraghammer and Vasselheim
1297.0,E1, Campaign 1 Episode 1 Arrival at Kraghammer ,MATT,"Okay. They all look at each other. ""If you can save enough for all four of us, please do. →",A1,Arc 1: Kraghammer and Vasselheim
