line #,episode #,episode,name,line,arc #,arc
1575.0,E1, Campaign 1 Episode 1 Arrival at Kraghammer ,LAURA,How much would this task be worth to you? Obviously we are doing you quite a favor and we brought you quite a gift! →,A1,Arc 1: Kraghammer and Vasselheim
1576.0,E1, Campaign 1 Episode 1 Arrival at Kraghammer ,SAM,This cost us a thousand gold. →,A1,Arc 1: Kraghammer and Vasselheim
1577.0,E1, Campaign 1 Episode 1 Arrival at Kraghammer ,MATT,"""Obviously this lass means a lot to you, doesn't she?"" →",A1,Arc 1: Kraghammer and Vasselheim
1578.0,E1, Campaign 1 Episode 1 Arrival at Kraghammer ,LAURA,"No, but I know she is probably wreaking havoc on your mines. →",A1,Arc 1: Kraghammer and Vasselheim
1579.0,E1, Campaign 1 Episode 1 Arrival at Kraghammer ,LIAM,We've come to correct the wrongs that she's done and come to bring her home. →,A1,Arc 1: Kraghammer and Vasselheim
1580.0,E1, Campaign 1 Episode 1 Arrival at Kraghammer ,MARISHA,It also sounds like there are some other terrible things wreaking havoc on your mines. →,A1,Arc 1: Kraghammer and Vasselheim
1581.0,E1, Campaign 1 Episode 1 Arrival at Kraghammer ,MATT,"""There is nothing going on, we're fine. We have everything under control, we don't need your help for that. If you want to find your friend, go find her! If she is still alive. If not, take her corpse back and leave."" →",A1,Arc 1: Kraghammer and Vasselheim
1582.0,E1, Campaign 1 Episode 1 Arrival at Kraghammer ,TALIESIN,"It's not help, sir. We are simply respecting you as a businessman. As a businessman I'm sure that you would disagree with unceremonious charity whether it would be to give it or receive it. We are making sure that our dealings with you are fair and balanced. →",A1,Arc 1: Kraghammer and Vasselheim
1583.0,E1, Campaign 1 Episode 1 Arrival at Kraghammer ,MATT,"""I appreciate your offering. You have bought your time. Now, if you are here to go find your friend, I'll let you pass. You may pass into the mine, but if at any moment you cross over to any sort of thieving bullshite--"" Looks over at you. ""I recommend--"" (laughter) ""I recommend-- that you fall down the same path your friend likely did and get killed real quick. I don't take kindly to those who cross on my business."" →",A1,Arc 1: Kraghammer and Vasselheim
1584.0,E1, Campaign 1 Episode 1 Arrival at Kraghammer ,TALIESIN,I doubt that we could find anything of more value that what we have already brought you. →,A1,Arc 1: Kraghammer and Vasselheim
1585.0,E1, Campaign 1 Episode 1 Arrival at Kraghammer ,LIAM,"We are here to right wrongs and I promise you, our business is finding her and returning home."" →",A1,Arc 1: Kraghammer and Vasselheim
1586.0,E1, Campaign 1 Episode 1 Arrival at Kraghammer ,MATT,"""Then go."" →",A1,Arc 1: Kraghammer and Vasselheim
1587.0,E1, Campaign 1 Episode 1 Arrival at Kraghammer ,LAURA,Is that our business? →,A1,Arc 1: Kraghammer and Vasselheim
1588.0,E1, Campaign 1 Episode 1 Arrival at Kraghammer ,TRAVIS,"Yeah, we are here to right wrongs and right lefts. →",A1,Arc 1: Kraghammer and Vasselheim
1589.0,E1, Campaign 1 Episode 1 Arrival at Kraghammer ,TALIESIN,And write comment cards. →,A1,Arc 1: Kraghammer and Vasselheim
1590.0,E1, Campaign 1 Episode 1 Arrival at Kraghammer ,MARISHA,"Wait, before we dive into this mountain-- we know that there's ghouls and god knows what else down there. Shouldn't we find out? →",A1,Arc 1: Kraghammer and Vasselheim
1591.0,E1, Campaign 1 Episode 1 Arrival at Kraghammer ,ORION,"Yes, we should. Maybe some arcane house could tell us how to deal with these things. →",A1,Arc 1: Kraghammer and Vasselheim
1592.0,E1, Campaign 1 Episode 1 Arrival at Kraghammer ,LAURA,Yes. Do we have permission to enter within the next few days? Obviously we might need to be prepared. →,A1,Arc 1: Kraghammer and Vasselheim
1593.0,E1, Campaign 1 Episode 1 Arrival at Kraghammer ,ORION,"Yes, do we have badges that we wear over so that they know--? →",A1,Arc 1: Kraghammer and Vasselheim
1594.0,E1, Campaign 1 Episode 1 Arrival at Kraghammer ,MATT,"""I'll speak with the men. They'll let you down. If you come back, good on you. I think our business here is done."" →",A1,Arc 1: Kraghammer and Vasselheim
1595.0,E1, Campaign 1 Episode 1 Arrival at Kraghammer ,TALIESIN,Yes. →,A1,Arc 1: Kraghammer and Vasselheim
1596.0,E1, Campaign 1 Episode 1 Arrival at Kraghammer ,MATT,"At which point, you hear muffled in the distance a loud ringing of a very loud bell. →",A1,Arc 1: Kraghammer and Vasselheim
1597.0,E1, Campaign 1 Episode 1 Arrival at Kraghammer ,MATT,"(dinging) At which point, he perks up a bit. ""Our business here is done. →",A1,Arc 1: Kraghammer and Vasselheim
1598.0,E1, Campaign 1 Episode 1 Arrival at Kraghammer ,MATT,"Please, shove off."" →",A1,Arc 1: Kraghammer and Vasselheim
1599.0,E1, Campaign 1 Episode 1 Arrival at Kraghammer ,SAM,Which way do we go? →,A1,Arc 1: Kraghammer and Vasselheim
1600.0,E1, Campaign 1 Episode 1 Arrival at Kraghammer ,MATT,"He looks over to the two other guards who are up front. The two Carvers say, ""This way."" →",A1,Arc 1: Kraghammer and Vasselheim
1601.0,E1, Campaign 1 Episode 1 Arrival at Kraghammer ,LIAM,While he is talking I take a flask out of my cloak and approach the barrel and surreptitiously pour a little bit of it into the flask. →,A1,Arc 1: Kraghammer and Vasselheim
1602.0,E1, Campaign 1 Episode 1 Arrival at Kraghammer ,MATT,Sleight of hand check. →,A1,Arc 1: Kraghammer and Vasselheim
1603.0,E1, Campaign 1 Episode 1 Arrival at Kraghammer ,SAM,You're stealing beer?! →,A1,Arc 1: Kraghammer and Vasselheim
1604.0,E1, Campaign 1 Episode 1 Arrival at Kraghammer ,ORION,"No, because we have to give it to those guards. →",A1,Arc 1: Kraghammer and Vasselheim
1605.0,E1, Campaign 1 Episode 1 Arrival at Kraghammer ,SAM,"Fuck those guards, I can kill them all. →",A1,Arc 1: Kraghammer and Vasselheim
1606.0,E1, Campaign 1 Episode 1 Arrival at Kraghammer ,LAURA,Can I talk to good old Nostoc while he's doing that? →,A1,Arc 1: Kraghammer and Vasselheim
1607.0,E1, Campaign 1 Episode 1 Arrival at Kraghammer ,MATT,"He currently does not seem like the talkative type at the moment, you can certainly try. →",A1,Arc 1: Kraghammer and Vasselheim
1608.0,E1, Campaign 1 Episode 1 Arrival at Kraghammer ,TALIESIN,I am going to make a fumble. I am going to attempt to assist a sleight of hand with a bit of a fumble. →,A1,Arc 1: Kraghammer and Vasselheim
1609.0,E1, Campaign 1 Episode 1 Arrival at Kraghammer ,MATT,He has already rolled it. →,A1,Arc 1: Kraghammer and Vasselheim
1610.0,E1, Campaign 1 Episode 1 Arrival at Kraghammer ,LAURA,Damn it. I am going to fall down. In front of Nostoc. →,A1,Arc 1: Kraghammer and Vasselheim
1611.0,E1, Campaign 1 Episode 1 Arrival at Kraghammer ,SAM,Oh! →,A1,Arc 1: Kraghammer and Vasselheim
1612.0,E1, Campaign 1 Episode 1 Arrival at Kraghammer ,LIAM,13. →,A1,Arc 1: Kraghammer and Vasselheim
1613.0,E1, Campaign 1 Episode 1 Arrival at Kraghammer ,LAURA,I am going to fall down in front of Nostoc. →,A1,Arc 1: Kraghammer and Vasselheim
1614.0,E1, Campaign 1 Episode 1 Arrival at Kraghammer ,MARISHA,Come on! →,A1,Arc 1: Kraghammer and Vasselheim
1615.0,E1, Campaign 1 Episode 1 Arrival at Kraghammer ,TALIESIN,He is distracted by a bell. →,A1,Arc 1: Kraghammer and Vasselheim
1616.0,E1, Campaign 1 Episode 1 Arrival at Kraghammer ,MATT,As you fill your flask-- →,A1,Arc 1: Kraghammer and Vasselheim
1617.0,E1, Campaign 1 Episode 1 Arrival at Kraghammer ,TRAVIS,Shit. Balls. Ass. →,A1,Arc 1: Kraghammer and Vasselheim
1618.0,E1, Campaign 1 Episode 1 Arrival at Kraghammer ,MATT,You hear this loud-- (clears throat). →,A1,Arc 1: Kraghammer and Vasselheim
1619.0,E1, Campaign 1 Episode 1 Arrival at Kraghammer ,LAURA,"Ow, oh my ankle! It hurts so very much. →",A1,Arc 1: Kraghammer and Vasselheim
1620.0,E1, Campaign 1 Episode 1 Arrival at Kraghammer ,MATT,"This is the first time you have witnessed the pristine, delicate yet well trained palm of a dwarven hand go straight to its forehead. →",A1,Arc 1: Kraghammer and Vasselheim
1621.0,E1, Campaign 1 Episode 1 Arrival at Kraghammer ,LIAM,"I carry the flask up to his cup and refill it and say: In my kingdom when a deal is set we drink together. I would like, not much, but to pour us all a drink and agree, surely this cask is weeks' worth of drink-- →",A1,Arc 1: Kraghammer and Vasselheim
1622.0,E1, Campaign 1 Episode 1 Arrival at Kraghammer ,MATT,"""Get out of my office."" →",A1,Arc 1: Kraghammer and Vasselheim
1623.0,E1, Campaign 1 Episode 1 Arrival at Kraghammer ,MARISHA,"Take the flask, take the flask. →",A1,Arc 1: Kraghammer and Vasselheim
1624.0,E1, Campaign 1 Episode 1 Arrival at Kraghammer ,LIAM,"I can see it is a cultural difference, my apologies. →",A1,Arc 1: Kraghammer and Vasselheim
1625.0,E1, Campaign 1 Episode 1 Arrival at Kraghammer ,ORION,Stop it. Just go! What are you doing? →,A1,Arc 1: Kraghammer and Vasselheim
1626.0,E1, Campaign 1 Episode 1 Arrival at Kraghammer ,LIAM,You're one to talk! →,A1,Arc 1: Kraghammer and Vasselheim
1627.0,E1, Campaign 1 Episode 1 Arrival at Kraghammer ,ORION,I'm on the earring. →,A1,Arc 1: Kraghammer and Vasselheim
1628.0,E1, Campaign 1 Episode 1 Arrival at Kraghammer ,MATT,A second and a third bell starts going off and the guards that are waiting for you guys. →,A1,Arc 1: Kraghammer and Vasselheim
1629.0,E1, Campaign 1 Episode 1 Arrival at Kraghammer ,MATT,"They're like-- They start leading you outside and as you make your way outside the main building, you can now hear voices shouting, down in the quarry below. →",A1,Arc 1: Kraghammer and Vasselheim
1630.0,E1, Campaign 1 Episode 1 Arrival at Kraghammer ,LAURA,I lean down to one of the guards and say: What is that bell for? →,A1,Arc 1: Kraghammer and Vasselheim
1631.0,E1, Campaign 1 Episode 1 Arrival at Kraghammer ,MATT,"""Something is flushing out of the quarry."" →",A1,Arc 1: Kraghammer and Vasselheim
1632.0,E1, Campaign 1 Episode 1 Arrival at Kraghammer ,LAURA,"Flushing, what does that mean? →",A1,Arc 1: Kraghammer and Vasselheim
1633.0,E1, Campaign 1 Episode 1 Arrival at Kraghammer ,MATT,"""We don't know."" Some of the guards are motioning each other to follow and some of them start going down to one of the tracks that leads down to one of the nearest quarry below. →",A1,Arc 1: Kraghammer and Vasselheim
1634.0,E1, Campaign 1 Episode 1 Arrival at Kraghammer ,TALIESIN,"Just try and like practically usher our guards in that direction, since they seem to want to go in that direction. Let's see if we can push them in that direction. →",A1,Arc 1: Kraghammer and Vasselheim
1635.0,E1, Campaign 1 Episode 1 Arrival at Kraghammer ,MATT,"Okay, you guys follow down towards the quarry, you ask the guard that question and he goes, ""I don't know, we've had quite a few interesting things come through."" →",A1,Arc 1: Kraghammer and Vasselheim
1636.0,E1, Campaign 1 Episode 1 Arrival at Kraghammer ,LAURA,"Like what? Oh, like what? →",A1,Arc 1: Kraghammer and Vasselheim
1637.0,E1, Campaign 1 Episode 1 Arrival at Kraghammer ,MATT,"He swallows and says, ""Things I can't describe."" →",A1,Arc 1: Kraghammer and Vasselheim
1638.0,E1, Campaign 1 Episode 1 Arrival at Kraghammer ,TALIESIN,"Well, we can certainly help, lead on. →",A1,Arc 1: Kraghammer and Vasselheim
1639.0,E1, Campaign 1 Episode 1 Arrival at Kraghammer ,MARISHA,Is there anybody running out? →,A1,Arc 1: Kraghammer and Vasselheim
1640.0,E1, Campaign 1 Episode 1 Arrival at Kraghammer ,MATT,"Not yet. As you head halfway down the quarry walkway, you begin seeing dwarves start running out of one of the large quarry tunnels. →",A1,Arc 1: Kraghammer and Vasselheim
1641.0,E1, Campaign 1 Episode 1 Arrival at Kraghammer ,MARISHA,I grab one of them. →,A1,Arc 1: Kraghammer and Vasselheim
1642.0,E1, Campaign 1 Episode 1 Arrival at Kraghammer ,MATT,"Well, they're quite a distance from you. →",A1,Arc 1: Kraghammer and Vasselheim
1643.0,E1, Campaign 1 Episode 1 Arrival at Kraghammer ,MATT,"You're still walking down the side. They're a good 100 feet from you. They start running at you, you see blood streaking down one of their faces. →",A1,Arc 1: Kraghammer and Vasselheim
1644.0,E1, Campaign 1 Episode 1 Arrival at Kraghammer ,TRAVIS,Yes! →,A1,Arc 1: Kraghammer and Vasselheim
1645.0,E1, Campaign 1 Episode 1 Arrival at Kraghammer ,MATT,"They're charging out, one of them has a weapon and is limping, and you start seeing small green scampering things rushing through. One, two, three, four, six, ten goblins come rushing out of the tunnel. →",A1,Arc 1: Kraghammer and Vasselheim
1646.0,E1, Campaign 1 Episode 1 Arrival at Kraghammer ,SAM,"Ah, I don't like these guys. →",A1,Arc 1: Kraghammer and Vasselheim
1647.0,E1, Campaign 1 Episode 1 Arrival at Kraghammer ,LAURA,We should attack them! I string my bow. →,A1,Arc 1: Kraghammer and Vasselheim
1648.0,E1, Campaign 1 Episode 1 Arrival at Kraghammer ,MARISHA,Don't you have family history with them? →,A1,Arc 1: Kraghammer and Vasselheim
1649.0,E1, Campaign 1 Episode 1 Arrival at Kraghammer ,MATT,"The three dwarves that are running out, one of them gets hacked down by one of the goblins and jumps on them and is tearing his neck. →",A1,Arc 1: Kraghammer and Vasselheim
1650.0,E1, Campaign 1 Episode 1 Arrival at Kraghammer ,TALIESIN,I take a shot. Right now. →,A1,Arc 1: Kraghammer and Vasselheim
1651.0,E1, Campaign 1 Episode 1 Arrival at Kraghammer ,LAURA,I take a shot. I shoot it! →,A1,Arc 1: Kraghammer and Vasselheim
1652.0,E1, Campaign 1 Episode 1 Arrival at Kraghammer ,MATT,"Okay, both you guys roll-- →",A1,Arc 1: Kraghammer and Vasselheim
1653.0,E1, Campaign 1 Episode 1 Arrival at Kraghammer ,LIAM,I throw a dagger. →,A1,Arc 1: Kraghammer and Vasselheim
1654.0,E1, Campaign 1 Episode 1 Arrival at Kraghammer ,MATT,"You throw a dagger? Three of you, roll for attack. →",A1,Arc 1: Kraghammer and Vasselheim
1655.0,E1, Campaign 1 Episode 1 Arrival at Kraghammer ,TALIESIN,19. →,A1,Arc 1: Kraghammer and Vasselheim
1656.0,E1, Campaign 1 Episode 1 Arrival at Kraghammer ,LAURA,15. →,A1,Arc 1: Kraghammer and Vasselheim
1657.0,E1, Campaign 1 Episode 1 Arrival at Kraghammer ,ORION,Is there a clear area where there's a bunch of goblins running? →,A1,Arc 1: Kraghammer and Vasselheim
1658.0,E1, Campaign 1 Episode 1 Arrival at Kraghammer ,MATT,There is an open funnel towards the tunnel. →,A1,Arc 1: Kraghammer and Vasselheim
1659.0,E1, Campaign 1 Episode 1 Arrival at Kraghammer ,ORION,"I'm going to throw a little Fireball, right there where those guys are. →",A1,Arc 1: Kraghammer and Vasselheim
1660.0,E1, Campaign 1 Episode 1 Arrival at Kraghammer ,MATT,"Okay, you guys you all hit from this distance because goblins are puny little things. →",A1,Arc 1: Kraghammer and Vasselheim
1661.0,E1, Campaign 1 Episode 1 Arrival at Kraghammer ,MATT,"They're still a little small to see, but you're all pretty well trained and pretty honed with your aim. You fire simultaneously, gunshot echo through the hallway, arrows, flying dagger, you see three goblins fall off a nearby dwarf who goes, ""Thank--"" At which point a large fireball explodes, killing off about ten or so of the goblins and probably two of the dwarves. →",A1,Arc 1: Kraghammer and Vasselheim
1662.0,E1, Campaign 1 Episode 1 Arrival at Kraghammer ,ORION,Sorry about that! →,A1,Arc 1: Kraghammer and Vasselheim
1663.0,E1, Campaign 1 Episode 1 Arrival at Kraghammer ,MATT,The guards stopped. →,A1,Arc 1: Kraghammer and Vasselheim
1664.0,E1, Campaign 1 Episode 1 Arrival at Kraghammer ,SAM,Did you do that? →,A1,Arc 1: Kraghammer and Vasselheim
1665.0,E1, Campaign 1 Episode 1 Arrival at Kraghammer ,ORION,Yeah. →,A1,Arc 1: Kraghammer and Vasselheim
1666.0,E1, Campaign 1 Episode 1 Arrival at Kraghammer ,SAM,Fuck. →,A1,Arc 1: Kraghammer and Vasselheim
1667.0,E1, Campaign 1 Episode 1 Arrival at Kraghammer ,MATT,They they start looking around and they see you pull out your weapons and they all take a step back and realize they don't want to die either. →,A1,Arc 1: Kraghammer and Vasselheim
1668.0,E1, Campaign 1 Episode 1 Arrival at Kraghammer ,MATT,"""Well go, if you're going to help, go!"" →",A1,Arc 1: Kraghammer and Vasselheim
1669.0,E1, Campaign 1 Episode 1 Arrival at Kraghammer ,TALIESIN,We run straight in. →,A1,Arc 1: Kraghammer and Vasselheim
1670.0,E1, Campaign 1 Episode 1 Arrival at Kraghammer ,MATT,"With you guys charging in, you can now see a handful more goblins are rushing out. They are like running really fast, sprinting. →",A1,Arc 1: Kraghammer and Vasselheim
1671.0,E1, Campaign 1 Episode 1 Arrival at Kraghammer ,MARISHA,"I throw Entangle up, in the distance wherever they're coming from. →",A1,Arc 1: Kraghammer and Vasselheim
1672.0,E1, Campaign 1 Episode 1 Arrival at Kraghammer ,MATT,"Okay, what's the radius on that? →",A1,Arc 1: Kraghammer and Vasselheim
1673.0,E1, Campaign 1 Episode 1 Arrival at Kraghammer ,MARISHA,Like a hundred feet. →,A1,Arc 1: Kraghammer and Vasselheim
1674.0,E1, Campaign 1 Episode 1 Arrival at Kraghammer ,MATT,That's the range. What is the radius? →,A1,Arc 1: Kraghammer and Vasselheim
1675.0,E1, Campaign 1 Episode 1 Arrival at Kraghammer ,MARISHA,"Oh, 20-foot radius. →",A1,Arc 1: Kraghammer and Vasselheim
1676.0,E1, Campaign 1 Episode 1 Arrival at Kraghammer ,MATT,"Okay. You find a portion of the central point where the things exit from the tunnel and these strange reddish vines begin to protrude and to begin to grab nearby goblins and pull them up in this massive, weird vine creature. You hear (stomping) and you now see two larger ogre-like creatures come storming out. →",A1,Arc 1: Kraghammer and Vasselheim
1677.0,E1, Campaign 1 Episode 1 Arrival at Kraghammer ,MARISHA,"Oh, shit! →",A1,Arc 1: Kraghammer and Vasselheim
1678.0,E1, Campaign 1 Episode 1 Arrival at Kraghammer ,ORION,Wonderful! →,A1,Arc 1: Kraghammer and Vasselheim
1679.0,E1, Campaign 1 Episode 1 Arrival at Kraghammer ,MATT,Everyone roll initiative. →,A1,Arc 1: Kraghammer and Vasselheim
1680.0,E1, Campaign 1 Episode 1 Arrival at Kraghammer ,MATT,(cheering) →,A1,Arc 1: Kraghammer and Vasselheim
1681.0,E1, Campaign 1 Episode 1 Arrival at Kraghammer ,MARISHA,"Oh, fuck. Goddamn it. →",A1,Arc 1: Kraghammer and Vasselheim
1682.0,E1, Campaign 1 Episode 1 Arrival at Kraghammer ,TALIESIN,Oh yeah! →,A1,Arc 1: Kraghammer and Vasselheim
1683.0,E1, Campaign 1 Episode 1 Arrival at Kraghammer ,TRAVIS,Take it! →,A1,Arc 1: Kraghammer and Vasselheim
1684.0,E1, Campaign 1 Episode 1 Arrival at Kraghammer ,MATT,"All right, do we have initiatives 25 to 20? →",A1,Arc 1: Kraghammer and Vasselheim
1685.0,E1, Campaign 1 Episode 1 Arrival at Kraghammer ,TALIESIN,27. →,A1,Arc 1: Kraghammer and Vasselheim
1686.0,E1, Campaign 1 Episode 1 Arrival at Kraghammer ,ORION,21. →,A1,Arc 1: Kraghammer and Vasselheim
1687.0,E1, Campaign 1 Episode 1 Arrival at Kraghammer ,LAURA,Wait! I didn't roll yet. →,A1,Arc 1: Kraghammer and Vasselheim
1688.0,E1, Campaign 1 Episode 1 Arrival at Kraghammer ,MARISHA,You rolled a 20? →,A1,Arc 1: Kraghammer and Vasselheim
1689.0,E1, Campaign 1 Episode 1 Arrival at Kraghammer ,TALIESIN,I rolled a 20 plus seven. →,A1,Arc 1: Kraghammer and Vasselheim
1690.0,E1, Campaign 1 Episode 1 Arrival at Kraghammer ,MATT,"21, you said? →",A1,Arc 1: Kraghammer and Vasselheim
1691.0,E1, Campaign 1 Episode 1 Arrival at Kraghammer ,ORION,I have 21. →,A1,Arc 1: Kraghammer and Vasselheim
1692.0,E1, Campaign 1 Episode 1 Arrival at Kraghammer ,MATT,21 for Tiberius. What did you get? One? Aw. →,A1,Arc 1: Kraghammer and Vasselheim
1693.0,E1, Campaign 1 Episode 1 Arrival at Kraghammer ,MARISHA,"Oh, I rolled a two. →",A1,Arc 1: Kraghammer and Vasselheim
1694.0,E1, Campaign 1 Episode 1 Arrival at Kraghammer ,LIAM,It's six with the plus. →,A1,Arc 1: Kraghammer and Vasselheim
1695.0,E1, Campaign 1 Episode 1 Arrival at Kraghammer ,SAM,Fellows. I don't like goblins. →,A1,Arc 1: Kraghammer and Vasselheim
1696.0,E1, Campaign 1 Episode 1 Arrival at Kraghammer ,LAURA,18. →,A1,Arc 1: Kraghammer and Vasselheim
1697.0,E1, Campaign 1 Episode 1 Arrival at Kraghammer ,MATT,"You now see Scanlan, who's usually a jovial individual, his eyes begin to tense with fury. →",A1,Arc 1: Kraghammer and Vasselheim
1698.0,E1, Campaign 1 Episode 1 Arrival at Kraghammer ,SAM,I don't like goblins. →,A1,Arc 1: Kraghammer and Vasselheim
1699.0,E1, Campaign 1 Episode 1 Arrival at Kraghammer ,MARISHA,Is there anything that you know? →,A1,Arc 1: Kraghammer and Vasselheim
1700.0,E1, Campaign 1 Episode 1 Arrival at Kraghammer ,SAM,"No, they will all die. Don't spare any of them. →",A1,Arc 1: Kraghammer and Vasselheim
1701.0,E1, Campaign 1 Episode 1 Arrival at Kraghammer ,TRAVIS,Copy that. →,A1,Arc 1: Kraghammer and Vasselheim
1702.0,E1, Campaign 1 Episode 1 Arrival at Kraghammer ,LAURA,18. →,A1,Arc 1: Kraghammer and Vasselheim
1703.0,E1, Campaign 1 Episode 1 Arrival at Kraghammer ,MATT,"All right, so we have-- →",A1,Arc 1: Kraghammer and Vasselheim
1704.0,E1, Campaign 1 Episode 1 Arrival at Kraghammer ,TRAVIS,"18, too. →",A1,Arc 1: Kraghammer and Vasselheim
1705.0,E1, Campaign 1 Episode 1 Arrival at Kraghammer ,TALIESIN,27! →,A1,Arc 1: Kraghammer and Vasselheim
1706.0,E1, Campaign 1 Episode 1 Arrival at Kraghammer ,LAURA,What?! →,A1,Arc 1: Kraghammer and Vasselheim
1707.0,E1, Campaign 1 Episode 1 Arrival at Kraghammer ,TRAVIS,"Yeah, buddy. →",A1,Arc 1: Kraghammer and Vasselheim
1708.0,E1, Campaign 1 Episode 1 Arrival at Kraghammer ,TALIESIN,I have 27 initiative. →,A1,Arc 1: Kraghammer and Vasselheim
1709.0,E1, Campaign 1 Episode 1 Arrival at Kraghammer ,MATT,15 to ten? Ten to five? Six. →,A1,Arc 1: Kraghammer and Vasselheim
1710.0,E1, Campaign 1 Episode 1 Arrival at Kraghammer ,TALIESIN,"Wow, oh my god. →",A1,Arc 1: Kraghammer and Vasselheim
1711.0,E1, Campaign 1 Episode 1 Arrival at Kraghammer ,SAM,I got a three. →,A1,Arc 1: Kraghammer and Vasselheim
1712.0,E1, Campaign 1 Episode 1 Arrival at Kraghammer ,MATT,Okay. All right. →,A1,Arc 1: Kraghammer and Vasselheim
1713.0,E1, Campaign 1 Episode 1 Arrival at Kraghammer ,MARISHA,Four. →,A1,Arc 1: Kraghammer and Vasselheim
1714.0,E1, Campaign 1 Episode 1 Arrival at Kraghammer ,LIAM,"It was a sudden attack, man. →",A1,Arc 1: Kraghammer and Vasselheim
1715.0,E1, Campaign 1 Episode 1 Arrival at Kraghammer ,SAM,We weren't ready. →,A1,Arc 1: Kraghammer and Vasselheim
1716.0,E1, Campaign 1 Episode 1 Arrival at Kraghammer ,MATT,You got a three. →,A1,Arc 1: Kraghammer and Vasselheim
1717.0,E1, Campaign 1 Episode 1 Arrival at Kraghammer ,MARISHA,To be fair I just cast Entangle. It works. I'm distracted holding Entangle. →,A1,Arc 1: Kraghammer and Vasselheim
1718.0,E1, Campaign 1 Episode 1 Arrival at Kraghammer ,MATT,"Yeah, it's fine. Then we have Scanlan. I'll get you guys in placement here, as your bear is currently back at the inn. →",A1,Arc 1: Kraghammer and Vasselheim
1719.0,E1, Campaign 1 Episode 1 Arrival at Kraghammer ,LAURA,He is still? →,A1,Arc 1: Kraghammer and Vasselheim
1720.0,E1, Campaign 1 Episode 1 Arrival at Kraghammer ,MATT,Unless you wanted to bring him along. →,A1,Arc 1: Kraghammer and Vasselheim
1721.0,E1, Campaign 1 Episode 1 Arrival at Kraghammer ,LAURA,"Well, I thought I brought him. I should have mentioned that. →",A1,Arc 1: Kraghammer and Vasselheim
1722.0,E1, Campaign 1 Episode 1 Arrival at Kraghammer ,MATT,"All right, we'll say you brought him along. →",A1,Arc 1: Kraghammer and Vasselheim
1723.0,E1, Campaign 1 Episode 1 Arrival at Kraghammer ,MATT,That's fine. →,A1,Arc 1: Kraghammer and Vasselheim
1724.0,E1, Campaign 1 Episode 1 Arrival at Kraghammer ,LAURA,"I'm sorry, I should have emphasized that more. →",A1,Arc 1: Kraghammer and Vasselheim
1725.0,E1, Campaign 1 Episode 1 Arrival at Kraghammer ,MATT,"That's all right. Those of you going first, we're going to keep you on the field here. →",A1,Arc 1: Kraghammer and Vasselheim
1726.0,E1, Campaign 1 Episode 1 Arrival at Kraghammer ,LAURA,Oh god. →,A1,Arc 1: Kraghammer and Vasselheim
1727.0,E1, Campaign 1 Episode 1 Arrival at Kraghammer ,MATT,A number of goblins that are currently held over here. →,A1,Arc 1: Kraghammer and Vasselheim
1728.0,E1, Campaign 1 Episode 1 Arrival at Kraghammer ,LAURA,They're easy. Goblins are easy. Orcs are not. →,A1,Arc 1: Kraghammer and Vasselheim
1729.0,E1, Campaign 1 Episode 1 Arrival at Kraghammer ,TRAVIS,"Yeah, those are mine. →",A1,Arc 1: Kraghammer and Vasselheim
1730.0,E1, Campaign 1 Episode 1 Arrival at Kraghammer ,LAURA,Ogres?! →,A1,Arc 1: Kraghammer and Vasselheim
1731.0,E1, Campaign 1 Episode 1 Arrival at Kraghammer ,MATT,"Top of the round, Percy you're up. →",A1,Arc 1: Kraghammer and Vasselheim
1732.0,E1, Campaign 1 Episode 1 Arrival at Kraghammer ,TALIESIN,I'm sitting down and I'm busting out Bad News. →,A1,Arc 1: Kraghammer and Vasselheim
1733.0,E1, Campaign 1 Episode 1 Arrival at Kraghammer ,MARISHA,Bust out Bad News! →,A1,Arc 1: Kraghammer and Vasselheim
1734.0,E1, Campaign 1 Episode 1 Arrival at Kraghammer ,MATT,"Percy stops just as he gets to the quarry, a little bit elevated, and he pulls out from a small sack on his back this large elongated contraption, this weird construction that looks similar to the pepperbox he usually carries, but much larger and cumbersome. He sets it up on the ground with a small stand at the front and preps itself with a visual point. →",A1,Arc 1: Kraghammer and Vasselheim
1735.0,E1, Campaign 1 Episode 1 Arrival at Kraghammer ,TALIESIN,Ogre. →,A1,Arc 1: Kraghammer and Vasselheim
1736.0,E1, Campaign 1 Episode 1 Arrival at Kraghammer ,MATT,Ogre back here? →,A1,Arc 1: Kraghammer and Vasselheim
1737.0,E1, Campaign 1 Episode 1 Arrival at Kraghammer ,TALIESIN,Yep. →,A1,Arc 1: Kraghammer and Vasselheim
